{
  "$schema": "https://json-schema.org/draft/2020-12/schema",
  "$id": "https://my-agent-teams.local/tasks/result.schema.json",
  "title": "Phase 1 Result Schema",
  "type": "object",
  "additionalProperties": false,
  "required": [
    "task_id",
    "agent",
    "status",
    "summary",
    "files_modified"
  ],
  "properties": {
    "task_id": {
      "type": "string",
      "minLength": 1
    },
    "agent": {
      "type": "string",
      "minLength": 1
    },
    "status": {
      "type": "string",
      "enum": [
        "ready_for_merge",
        "blocked",
        "failed"
      ]
    },
    "summary": {
      "type": "string",
      "minLength": 1
    },
    "files_modified": {
      "type": "array",
      "items": {
        "type": "string",
        "minLength": 1
      }
    },
    "artifacts": {
      "type": "array",
      "items": {
        "$ref": "#/$defs/artifact"
      }
    },
    "next_action": {
      "type": "string"
    },
    "error_message": {
      "type": "string"
    },
    "reported_at": {
      "type": "string",
      "format": "date-time"
    }
  },
  "$defs": {
    "artifact": {
      "type": "object",
      "additionalProperties": false,
      "required": [
        "type",
        "path"
      ],
      "properties": {
        "type": {
          "type": "string",
          "minLength": 1
        },
        "path": {
          "type": "string",
          "minLength": 1
        },
        "description": {
          "type": "string"
        }
      }
    }
  }
}
